{
  "personLifeEventDateTime": "00:00:01",
  "personLifeEventType": "ullamco sed magna mollit",
  "id": null,
  "individual": [
    "dolor commodo"
  ],
  "auditInfo": {
    "isDeleted": true,
    "createdBy": "aute",
    "updatedBy": "dolor nulla do nisi sed",
    "updatedDate": null,
    "createdDate": "1946-11-22T14:08:46.496Z"
  }
}
